id;type;name;status;description;duration;timeStart;epicID
1;TASK;Помыть посуду;DONE;Помыть всю посуду в раковине;PT10M;2024-10-24T22:29:52.297350100;
2;TASK;Сходить в магазин;IN_PROGRESS;Купить продукты на ужин;PT10M;2024-10-25T03:29:52.298351;
3;EPIC;Организация дня рождения;IN_PROGRESS;Запланировать день рождения, купить подарки, организовать вечеринку;PT30M;2024-10-24T21:39:52.298351;
4;SUB;Запланировать день рождения;IN_PROGRESS;Выбрать дату, место, гостей;PT10M;2024-10-24T21:39:52.298351;3
5;SUB;Купить подарки;DONE;Выбрать подарки для всех гостей;PT10M;2024-10-24T21:59:52.298351;3
